Assessment Name,URL,Remote Testing,Adaptive/IRT,Test Type,Duration,Job Description,Job Levels,Languages
Account Manager Solution,https://www.shl.com/solutions/products/product-catalog/view/account-manager-solution/,Yes,Yes,C P A B,49,"The Account Manager solution is an assessment used for job candidates applying to mid-level leadership positions that tend to manage the day-to-day operations and activities of client accounts. Sample tasks for these jobs include, but are not limited to: communicating with clients about project status, developing and maintaining project plans, coordinating internally with appropriate project personnel, and ensuring client expectations are being met. Potential job titles that use this solution are: Account Executive, Account Manager, and Senior Account Manager. There are multiple configurations of this solution available.","Mid-Professional,","English (USA),"
Administrative Professional - Short Form,https://www.shl.com/solutions/products/product-catalog/view/administrative-professional-short-form/,Yes,Yes,A K P,36,"The Administrative Professional solution is for entry to mid-level positions that involve routine clerical and administrative functions in addition to office management functions and customer service. Sample tasks for this job include, but are not limited to: arranging conference calls; drafting correspondence; scheduling meetings; greeting visitors; coordinating office activities. Potential job titles that use this solution are: Administrative Assistant, Secretary, Office Manager, Administrative Aide, and Administrative Associate.","Entry-Level,","English (USA),"
Agency Manager Solution,https://www.shl.com/solutions/products/product-catalog/view/agency-manager-solution/,Yes,Yes,A B P S,51,"The Agency Manager solution is for mid-level sales management positions that include front line management and sales responsibilities. Sample tasks for this job include, but are not limited to: directing and coordinating financial activities of workers in a branch, office, or department of an establishment, such as branch bank, brokerage firm, risk and insurance department, or credit department. Potential job titles that use this solution are: Agency Manager, Brokerage Manager. Multiple configurations of this solution are available.","Front Line Manager, Manager, Supervisor,","English (USA),"
Apprentice + 8.0 Job Focused Assessment,https://www.shl.com/solutions/products/product-catalog/view/apprentice-8-0-job-focused-assessment-4261/,Yes,No,B P,30,"The Apprentice + 8.0 Job-Focused Assessment is a short, targeted, globally applicable assessment which includes a short cognitive ability measure. This assessment is designed for entry-level positions appropriate for countries and industries that use an apprenticeship model. It is intended to be used multi-nationally for organisations whose business spans across regions.","General Population, Graduate, Entry-Level,","English International, German,"
Apprentice 8.0 Job Focused Assessment,https://www.shl.com/solutions/products/product-catalog/view/apprentice-8-0-job-focused-assessment/,Yes,No,B P,20,"The Apprentice 8.0 Job-Focused Assessment is a short, targeted, globally applicable assessment. This assessment is designed for entry-level positions appropriate for countries and industries that use an apprenticeship model. It is intended to be used multi-nationally for organizations whose business spans across regions.","Entry-Level, General Population, Graduate,","English International, German, French,"
Bank Administrative Assistant - Short Form,https://www.shl.com/solutions/products/product-catalog/view/bank-administrative-assistant-short-form/,Yes,No,A B K P,35,"The Administrative Assistant solution is for entry-level clerical positions that interact with external or internal customers. Sample tasks for these jobs include, but are not limited to: answering telephones, managing files and records, sorting mail, greeting customers, and collaborating with co-workers on projects. Potential job titles that use this solution are: Receptionist and Administrative Assistant. There are multiple configurations of this solution available.","Entry-Level,","English (USA),"
Bank Collections Agent - Short Form,https://www.shl.com/solutions/products/product-catalog/view/bank-collections-agent-short-form/,Yes,No,A B P,45,"This solution is for entry-level collections positions in an inbound or outbound call center environment in a financial setting. Candidates answer multiple choice questions to measure achievement orientation, dependability, collector numerical skills, revenue recovery, customer focus, and persistence and planfulness. There are multiple configurations and versions of this solution available.","Entry-Level,","English (USA),"
Bank Operations Supervisor - Short Form,https://www.shl.com/solutions/products/product-catalog/view/bank-operations-supervisor-short-form/,Yes,Yes,A B P S,45,"The Bank Operations Supervisor solution is for job candidates applying to entry-level leadership positions who tend to supervise hourly employees. Sample tasks for these jobs include, but are not limited to: planning and preparing work schedules, assigning employees to specific duties; coaching employees on attendance, conduct, schedule adherence, and work tasks, developing employees' skills ; training subordinates; prioritizing multiple tasks and priorities; and making day-to-day decisions with minimal guidance from others. Potential job titles that use this solution are: Team Leader, First Line Supervisor, Processing Supervisor, Call Center Supervisor, and Customer Service Supervisor. There are multiple configurations and versions of this solution available.","Front Line Manager, Manager, Supervisor,","English (USA),"
Bilingual Spanish Reservation Agent Solution,https://www.shl.com/solutions/products/product-catalog/view/bilingual-spanish-reservation-agent-solution/,Yes,Yes,B P S A,43,"The Bilingual Reservation Agent solution is designed for customer centered entry-level positions within the hospitality industry. Sample tasks may include making, updating, or canceling hotel reservations made in English or Spanish; listening to customers speak Spanish and entering information into a computer in English; providing information on the hotel and the services offered. Potential job titles that use this solution are: Bilingual Reservation Agent, Customer Service Representative and Reservationist. Multiple configurations of this solution are available.","Entry-Level,","English (USA), Latin American Spanish,"
"Bookkeeping, Accounting, Auditing Clerk Short Form",https://www.shl.com/solutions/products/product-catalog/view/bookkeeping-accounting-auditing-clerk-short-form/,Yes,Yes,P S K B A,49,"The Bookkeeping, Accounting, and Auditing Clerk solution is for entry-level positions that involve entering numerical data into computer systems and maintaining financial records. Sample tasks for this job include, but are not limited to: entering financial data into computers; checking financial records for accuracy; perform routine computations on financial data. Potential job titles that use this solution are: Accounting Clerk, Bookkeeper, Accounting Associate, Auditing Clerk and Accounts Receivable Clerk.","Entry-Level,","English (USA),"
Branch Manager - Short Form,https://www.shl.com/solutions/products/product-catalog/view/branch-manager-short-form/,Yes,No,A B P,50,"This solution is for mid to upper-level financial institution managerial positions. Candidates answer a series of multiple choice questions to measure management potential, management judgment, leadership potential, team management, branch manager problem solving, business leadership, leadership motivation, interpersonal leadership, self leadership, and branch manager judgment. There are multiple configurations and versions of this solution available.","Front Line Manager, Manager, Supervisor,","English (USA),"
Cashier Solution,https://www.shl.com/solutions/products/product-catalog/view/cashier-solution/,Yes,Yes,B A P,28,"The Cashier solution is for entry-level retail positions in which employees receive payment in the form of cash, check, or credit cards for goods purchased. Sample tasks for these jobs include, but are not limited to: handling payments, offering customer service, and issuing receipts and refunds. Potential job titles that use this solution are: Cashier, Sales Associate, and Clerk. There are multiple configurations and versions of this solution available.","Entry-Level,","English (USA),"
Claims/Operations Supervisor Solution,https://www.shl.com/solutions/products/product-catalog/view/claimsoperations-supervisor-solution/,Yes,Yes,P S A B,48,"The Claims/Operations Supervisor solution is for entry-level management positions that involve supervising hourly employees. Sample tasks for this job include, but are not limited to: planning and preapring work schedules; assigning employees to specific dutites; coaching employees on attendance, conduct, schedule adherence, and work tasks; developing employees' skills; training subordinates; prioritizing multiple tasks and priorities; making day-to-day decisions with minimal guidance from others. Potential job titles that use this solution are: Team Leader, Coach, First Line Supervisor, Claims Supervisor, Operations Supervisor, and Customer Service Supervisor. Multiple configurations of this solution are available.","Manager,","English (USA),"
Contact Center Customer Service + 8.0,https://www.shl.com/solutions/products/product-catalog/view/contact-center-customer-service-8-0/,Yes,No,A B C P S,41,"The Contact Center + 8.0 - Customer Service Job Focused Assessment is designed to measure the skills, competencies, and behaviors needed for success in contact center roles where the main focus is customer service. This JFA includes a mobile-optimized contact center simulation, a behavioral assessment, and a cognitive test. Together, these assessments capture the ability to provide exceptional customer service in entry-level contact center roles.","Entry-Level,","English (USA), English International, French, German, Latin American Spanish, Chinese Simplified, Portuguese (Brazil), Japanese,"
Contact Center Customer Service 8.0,https://www.shl.com/solutions/products/product-catalog/view/contact-center-customer-service-8-0-4269/,Yes,No,S B C P,31,The Customer Service 8.0 JFA is designed for entry-level positions in a contact center environment where the main focus is customer service.,"Entry-Level,","English (USA), German, Portuguese (Brazil), English International, Latin American Spanish, French (Canada), French,"
Contact Center Manager - Short Form,https://www.shl.com/solutions/products/product-catalog/view/contact-center-manager-short-form/,Yes,Yes,A B P S,50,"The Contact Center - Manager solution is for mid to upper-level contact center managerial positions. Sample tasks for these jobs include, but are not limited to: supervising and coordinating the activities of subordinates; interacting day-to-day with subordinates; and training employees. Potential job titles that use this solution are: Contact Center Team Leader, First Line Supervisor, and Contact Center Manager.","Manager, Supervisor, Front Line Manager,","English (USA),"
Contact Center Sales & Service + 8.0,https://www.shl.com/solutions/products/product-catalog/view/contact-center-sales-and-service-8-0/,Yes,No,P B C A S,41,"The Contact Center + 8.0 - Sales & Service Job Focused Assessment is designed to measure the skills, competencies, and behaviors needed for success in contact center roles that involve sales-related behaviors such as recommending products or services and retaining customers. This JFA includes a mobile-optimized contact center simulation, a behavioral assessment, and a cognitive test. Together, these assessments capture the ability to provide exceptional customer service and drive sales in entry-level contact center roles.","Entry-Level,","English International, English (USA),"
Contact Center Sales & Service 8.0,https://www.shl.com/solutions/products/product-catalog/view/contact-center-sales-and-service-8-0-4268/,Yes,No,S B C P,31,The Sales & Service 8.0 JFA is designed for contact center roles that involve sales or sales-related behaviors such as recommending products or services and retaining customers.,"Entry-Level,","English International, English (USA),"
Contact Center Team Lead/Coach - Short Form,https://www.shl.com/solutions/products/product-catalog/view/contact-center-team-leadcoach-short-form/,Yes,Yes,A B P S,45,"The Contact Center - Team Lead/Coach solution is for job candidates applying to entry-level leadership positions who tend to supervise hourly employees. Sample tasks for these jobs include, but are not limited to: planning and preparing work schedules; assigning employees to specific duties; coaching employees on attendance, conduct, schedule adherence, and work tasks; developing employees' skills; training subordinates or less tenured peers; prioritizing multiple tasks and priorities; and making day-to-day decisions with minimal guidance from others. Potential job titles that use this solution are: Team Leader, Coach, First Line Supervisor, Processing Supervisor, Call Center Supervisor, and Customer Service Supervisor.","Front Line Manager, Professional Individual Contributor, Supervisor,","English (USA),"
Contact Centre Agent Solution - UK,https://www.shl.com/solutions/products/product-catalog/view/contact-centre-agent-solution-uk/,Yes,No,A B P S,39,"This solution is used for job candidates applying to entry-level positions in a contact centre environment where the main focus of the job is customer service. The candidate answers multiple choice questions as well as questions in a customer call simulation environment. The solution measures: working with information, customer focus, contact centre retention, navigation, service orientation, and tactful problem solving. In addition, the solution measures data entry speed and accuracy, multi-tasking preferences, achievement orientation and conscientiousness.","Entry-Level,","English International,"
Customer Service - Short Form,https://www.shl.com/solutions/products/product-catalog/view/customer-service-short-form/,Yes,Yes,A B P,42,"The Customer Service Representative Solution is for entry-level positions that involve a high degree of interaction with customers in person or on the phone. Sample tasks for this job include, but are not limited to: taking orders; solving product or service issues; responding positively to difficult customers; referring unresolved issues to the appropriate individuals; providing information on products and/or services. Potential job titles that use this solution are: Account Service Representative, Account Representative, Customer Service Representative, and Customer Service Agent.","Entry-Level,","English (USA), English International,"
Customer Service - Short Form - UK,https://www.shl.com/solutions/products/product-catalog/view/customer-service-short-form-uk/,Yes,Yes,A B P,42,"The Customer Service Representative solution is for entry-level positions that involve a high degree of interaction with customers in person or on the phone. Sample tasks for this job include, but are not limited to: taking orders; solving product or service issues; responding positively to difficult customers; referring unresolved issues to the appropriate individuals; providing information on products and/or services. Potential job titles that use this solution are: Account Service Representative, Account Representative, Customer Service Representative, and Customer Service Agent.","Entry-Level,","English International,"
Customer Service with Sales - Short Form,https://www.shl.com/solutions/products/product-catalog/view/customer-service-with-sales-short-form/,Yes,Yes,A B P,44,"The Customer Service with Sales solution is for entry-level positions that involve both providing service and support to customers and selling goods and services. Sample tasks for this job include, but are not limited to: taking orders; solving product or service issues; selling products and services; responding positively to difficult customers; adding new goods and services to existing accounts; providing information on products and/or services. Potential job titles that use this solution are: Account Service Representative, Account Representative, Customer Service Representative, and Sales Representative.","Entry-Level,","English (USA),"
Director - Short Form,https://www.shl.com/solutions/products/product-catalog/view/director-short-form/,Yes,Yes,A B P,69,"The Director solution is intended for use with senior level positions responsible for the planning, directing, or coordinating key business activities and operations of companies. Duties and responsibilities include formulating policies, managing daily operations, and planning the use of materials and human resources. Potential job titles that use this solution are: Director, Regional Director, and Director of Operations.","Director,","English (USA),"
District/Regional Manager Solution,https://www.shl.com/solutions/products/product-catalog/view/districtregional-manager-solution/,Yes,Yes,A B P,65,"The District/Regional Manager solution is for mid- to senior-level managerial positions that oversee multiple stores within a defined area. Sample tasks for these jobs include, but are not limited to: directing a group of supervisors or managers, having profit and loss responsibility for a district or region, and aligning work with overall company goals. Potential job titles that use this solution are: Regional Director, District Manager, General Manager, Regional Manager, Store Manager, and Area Manager. There are multiple configurations and versions of this solution available.","Manager,","English (USA),"
Entry Level Cashier 7.1 (Americas),https://www.shl.com/solutions/products/product-catalog/view/entry-level-cashier-7-1-%28americas%29/,Yes,No,B P A,18,"The Entry level Cashier 7.1 solution is for entry-level retail positions in which employees receive payment in the form of cash, check, or credit cards for goods purchased. Sample tasks for these jobs include, but are not limited to: handling payments, offering customer service, and issuing receipts and refunds. Potential job titles that use this solution are: Cashier, Sales Associate, and Clerk.","Entry-Level,","French (Canada), Latin American Spanish, English (USA), English International,"
Entry Level Cashier 7.1 (International),https://www.shl.com/solutions/products/product-catalog/view/entry-level-cashier-7-1-%28international%29/,Yes,No,A B P,18,"The Entry level Cashier 7.1 solution is for entry-level retail positions in which employees receive payment in the form of cash, check, or credit cards for goods purchased. Sample tasks for these jobs include, but are not limited to: handling payments, offering customer service, and issuing receipts and refunds. Potential job titles that use this solution are: Cashier, Sales Associate, and Clerk.","Entry-Level,","English (USA),"
Entry Level Customer Service 7.1 (Americas),https://www.shl.com/solutions/products/product-catalog/view/entry-level-customer-service-7-1-%28americas%29/,Yes,No,C P,19,"The Entry Level Customer Service Solution (Retail and Contact Center) 7.1 is for entry-level positions in which employees interact with customers by providing information or carrying out customer requests related to an organizations products or services. Sample tasks for these jobs include, but are not limited to: interacting with customers on the phone or in person; taking orders; solving product or service issues; and responding positively to difficult or irate customers.
“IMPORTANT! Please note that you will need to select the correct package depending on which norm you intend to use. The package available for this product is International, South Africa and Americas"".","Entry-Level,","German, Finnish, Portuguese (Brazil), English (USA), Norwegian, Dutch, Arabic, Swedish, French (Canada), Italian, Danish, English International, Chinese Simplified, Latin American Spanish, French,"
Entry Level Customer Service 7.1 (International),https://www.shl.com/solutions/products/product-catalog/view/entry-level-customer-service-%28retail-and-cc%29-7-1/,Yes,No,C P,19,"The Entry Level Customer Service Solution (Retail and Contact Center) 7.1 is for entry-level positions in which employees interact with customers by providing information or carrying out customer requests related to an organizations products or services. Sample tasks for these jobs include, but are not limited to: interacting with customers on the phone or in person; taking orders; solving product or service issues; and responding positively to difficult or irate customers.
“IMPORTANT! Please note that you will need to select the correct package depending on which norm you intend to use. The package available for this product is International, South Africa and Americas"".","Entry-Level,","French, Dutch, English (USA), English International, Italian, German,"
Entry Level Customer Service 7.1 (South Africa),https://www.shl.com/solutions/products/product-catalog/view/entry-level-customer-service-7-1-%28south-africa%29/,Yes,No,C P,19,"The Entry Level Customer Service Solution (Retail and Contact Center) 7.1 is for entry-level positions in which employees interact with customers by providing information or carrying out customer requests related to an organization's products or services. Sample tasks for these jobs include but are not limited to interacting with customers on the phone or in person; taking orders; solving product or service issues; and responding positively to difficult or irate customers.
“IMPORTANT! Please note that you will need to select the correct package depending on which norm you intend to use. The package available for this product is International, South Africa and Americas"".","Entry-Level,","English International,"
Entry level Sales 7.1 (Americas),https://www.shl.com/solutions/products/product-catalog/view/entry-level-sales-7-1-%28americas%29/,Yes,No,B C P,20,"The Entry Level Sales 7.1 Solution is for entry-level positions in which employees proactively sell products or services to customers and have their compensation and/or performance based on sales revenue. Sample tasks for these jobs include, but are not limited to: promoting products to customers, persuading customers to buy products, and completing a transaction with a customer.","Entry-Level,","Portuguese (Brazil),"
Entry level Sales 7.1 (International),https://www.shl.com/solutions/products/product-catalog/view/entry-level-sales-7-1/,Yes,No,P B C,20,"The Entry Level Sales 7.1 Solution is for entry-level positions in which employees proactively sell products or services to customers and have their compensation and/or performance based on sales revenue. Sample tasks for these jobs include, but are not limited to: promoting products to customers, persuading customers to buy products, and completing a transaction with a customer.
Report Language Availability: English (USA), English International, Portuguese, French Canadian, German, French, Chinese Simplified, Spanish, North American Spanish.","Entry-Level,","English (USA), Spanish, Latin American Spanish, French, German, French (Canada), English International, Chinese Simplified, Portuguese,"
Entry Level Sales Sift Out 7.1,https://www.shl.com/solutions/products/product-catalog/view/entry-level-sales-sift-out-7-1/,Yes,No,C P B,20,"The Entry Level Sales Sift Out 7.1 Solution is for entry-level positions in which employees proactively sell products or services to customers and have their compensation and/or performance based on sales revenue. Sample tasks for these jobs include, but are not limited to: promoting products to customers, persuading customers to buy products, and completing a transaction with a customer","Entry-Level,","Swedish, Chinese Simplified, Finnish, English (USA), Portuguese (Brazil), French, Danish, Italian, Arabic, Dutch, French (Canada), Latin American Spanish, English International, Norwegian, German,"
Event Sales Manager Solution,https://www.shl.com/solutions/products/product-catalog/view/event-sales-manager-solution/,Yes,Yes,S A B P,50,"The Event Sales Manager solution is designed for management level positions in the hospitality industry. Sample tasks include selling use of facility space for special events and managing staff. The solution is focused on sales, solving problems and making good decisions. Potential job titles that use this solution are: Event Sales Manager, Events Manager and Special Events Manager. Multiple configurations of this solution are available.","Supervisor, Front Line Manager, Manager,","English (USA),"
Executive - Short Form,https://www.shl.com/solutions/products/product-catalog/view/executive-short-form/,Yes,Yes,A B P,74,"The Executive solution is intended for use with senior executive level positions responsible for planning, directing, or coordinating key business activities and operations at the highest level of an organization. Executives at this level often accomplish their work through subordinate executives and provide overall direction to their organization by determining and formulating policies within guidelines set up by a board of directors or similar governing body. Potential job titles that use this solution are: Executive Vice President, President, and Executive Director.","Executive,","English (USA),"
