Assessment Name,URL,Remote Testing,Adaptive/IRT,Test Type,Duration,Job Description,Job Levels,Languages
Project Manager - Short Form,https://www.shl.com/solutions/products/product-catalog/view/project-manager-short-form/,Yes,Yes,A B P S,49,"The Project Manager solution is designed for positions that lead medium to large scale projects with multiple team members involved. Sample tasks for this job include, but are not limited to: guiding, supervising, and influencing project team members, scoping project resource requirements, and managing project timelines, scope and budgets. Potential job titles that ues this solution are: Project Manager, Implementation Manager, Construction Project Manager and IT Project Manager.","Professional Individual Contributor,","English (USA),"
Proof Operator - Processing Specialist -Short Form,https://www.shl.com/solutions/products/product-catalog/view/proof-operator-processing-specialist-short-form/,Yes,No,S,30,"The Proof Operator – Processing Specialist solution is for entry-level positions that perform basic daily bank operations procedures such as the processing of deposits, reconciling accounts, and handling money transfers. Potential job titles include: Proof Operator, Bank Operations Processor, and Operations Specialist.","Entry-Level,","English (USA),"
Reservation Agent Solution,https://www.shl.com/solutions/products/product-catalog/view/reservation-agent-solution/,Yes,Yes,A P S B,43,"The Reservation Agent solution is designed for entry-level positions within the hospitality industry. Sample tasks may indlude making, updating, or canceling reservations; looking up information and entering information into a computer; providing information on the hotel and the services offered. Potential titles that use this solution are: Reservation Agent, Customer Service Representative and Reservationist. Multiple configurations of this solution are available.","Entry-Level,","English (USA),"
Restaurant Manager Solution,https://www.shl.com/solutions/products/product-catalog/view/restaurant-manager-solution/,Yes,Yes,A B P S,48,"The Restaurant Manager solution is designed for management level positions in the hospitality industry. Sample tasks include purchasing food and supplies, accounting, setting policies and procedures, and managing staff. The solution is focused on managing staff, solving problems, making good decisions and maintaining focus on the customer. Potential job titles that use this solution are: Restaurant Manager and General Manager. Multiple configurations of this solution are available.","Front Line Manager, Manager, Supervisor,","English (USA),"
Restaurant Supervisor Solution,https://www.shl.com/solutions/products/product-catalog/view/restaurant-supervisor-solution/,Yes,Yes,A B P,53,"The Restaurant Supervisor solution is designed for management level positions in the hospitality industry. Sample tasks include serving as a staff resource, setting schedules and monitoring daily operations. The solution is focused on solving problems, making good decisions and maintaining focus on the customer. Potential job titles that use this solution are: Restaurant Supervisor and Restaurant Staff Supervisor. Multiple configurations of this solution are available.","Front Line Manager, Manager, Supervisor,","English (USA),"
Retail Consultant Solution,https://www.shl.com/solutions/products/product-catalog/view/retail-consultant-solution/,Yes,Yes,A B P,45,"The Retail Consultant solution is for entry to mid-level retail positions in which employees proactively sell products to customers, develop relationships with repeat customers, and have their pay and/or performance heavily based on sales revenue. Sample tasks for these jobs include, but are not limited to: promoting products to customers, persuading customers to buy products, and building ongoing customer relationships. Potential job titles that use this solution are: Sales Consultant, Sales Representative, and Retail Sales Associate. There are multiple configurations and versions of this solution available.","Entry-Level,","English (USA),"
Retail Manager w/ Sales Solution,https://www.shl.com/solutions/products/product-catalog/view/retail-manager-w-sales-solution/,Yes,Yes,A B P,43,"The Retail Manager with Sales solution is an assessment used for job candidates applying to entry-level leadership positions who tend to supervise hourly employees but also have a significant portion of their job performance based on sales and customer service. Sample tasks for these jobs include, but are not limited to: planning and preparing work schedules, assigning employees to specific duties; promoting products to customers; training subordinates; building ongoing customer relationships; and making day-to-day decisions with minimal guidance from others. Potential job titles that use this solution are: Assistant Manager, Sales Supervisor, Retail Manager, and Floor Leader. There are multiple configurations and versions of this solution available.","Front Line Manager, Manager, Supervisor,","English (USA),"
Retail Sales Associate Solution,https://www.shl.com/solutions/products/product-catalog/view/retail-sales-associate-solution/,Yes,Yes,A B P,29,"The Retail Sales Associate solution is for entry-level retail positions in which employees proactively sell products to customers and have their pay and/or performance based on sales revenue. Sample tasks for these jobs include, but are not limited to: promoting products to customers, persuading customers to buy products, and completing a transaction with a customer. Potential job titles that use this solution are: Sales Representative, Retail Sales Associate, and Sales Clerk. There are multiple configurations and versions of this solution available.","Entry-Level,","English (USA),"
Sales Director Solution,https://www.shl.com/solutions/products/product-catalog/view/sales-director-solution/,Yes,Yes,A B P,59,"The Sales Director solution is for mid- to senior-level sales management positions that oversee the sales function across multiple offices or geographic territories. Sample tasks for these jobs include, but are not limited to: directing a group of sales supervisors or sales managers, having profit and loss responsibility for a district or region, and aligning work with overall company goals. Potential job titles that use this solution are: Regional Sales Director, District Sales Manager, and Sales Director. Multiple configurations of this solution are available.","Director, Front Line Manager, Manager,","English (USA),"
Sales Engineer Solution,https://www.shl.com/solutions/products/product-catalog/view/sales-engineer-solution/,Yes,Yes,A B K P S,61,"The Sales Engineer solution is designed for use with professional level telecommunications engineers with distinct sales responsibilities. The solution is focused on positions that involve the design of telecommunications networks for specific customer applications, and places an emphasis on reasoning ability and sales ability. Sample tasks may include: designing network solutions to meet customer needs, communicating technical information to all levels of clients participating in the sales process, assisting or owning the sales process, and ensuring proper implementation of contracted equipment and services. Potential job titles that use this solution are: Sales Engineer, Senior Technical Consultant, and Technical Sales Lead. There are multiple configurations of this solution available.","Professional Individual Contributor,","English (USA),"
Sales Manager Solution,https://www.shl.com/solutions/products/product-catalog/view/sales-manager-solution/,Yes,Yes,A B P,63,"The Sales Manager solution is an assessment used for applying to entry to mid-level sales leadership positions that generally manage employees and have a significant portion of their job performance based on sales. Sample tasks for these jobs include, but are not limited to: planning and preparing sales plans, promoting products to customers, training subordinates, building ongoing customer relationships, and making day-to-day decisions with minimal guidance from others. Potential job titles that use this solution are: Sales Manager and Manager of Direct Sales.","Front Line Manager, Manager,","English (USA),"
Sales Professional 7.0 Solution,https://www.shl.com/solutions/products/product-catalog/view/sales-professional-7-0-solution/,Yes,No,C B,21,"Our Sales Professional 7.0 solution is designed for entry to mid-level sales positions in which employees proactively sell products to customers, develop relationships with repeat customers, and have their pay and/or performance heavily based on sales revenue. Sample tasks for these jobs include, but are not limited to: promoting products to customers, persuading customers to buy products, and building ongoing customer relationships.
Report Language Availability: English (USA).","Mid-Professional, Professional Individual Contributor,","English International, English (USA), French (Canada), Latin American Spanish,"
Sales Professional 7.1 (Americas),https://www.shl.com/solutions/products/product-catalog/view/sales-professional-7-1-%28americas%29/,Yes,No,B C,21,"Our Sales Professional 7.1 solution is designed for entry to mid-level sales positions in which employees proactively sell products to customers, develop relationships with repeat customers, and have their pay and/or performance heavily based on sales revenue. Sample tasks for these jobs include, but are not limited to: promoting products to customers, persuading customers to buy products, and building ongoing customer relationships.","Professional Individual Contributor, Mid-Professional,","English (USA), Portuguese (Brazil), Latin American Spanish, French (Canada),"
Sales Professional Solution,https://www.shl.com/solutions/products/product-catalog/view/sales-professional-solution/,Yes,Yes,A B P,47,"The Sales Professional solution is for entry to mid-level sales positions in which employees proactively sell products to customers, develop relationships with repeat customers, and have their pay and/or performance heavily based on sales revenue. Sample tasks for these jobs include, but are not limited to: promoting products to customers, persuading customers to buy products, and building ongoing customer relationships. Potential job titles that use this solution are: Sales Consultant, Sales Representative, and Account Representative. Multiple configurations of this solution are available.","Mid-Professional,","English (USA),"
Sales Representative Solution,https://www.shl.com/solutions/products/product-catalog/view/sales-representative-solution/,Yes,Yes,A B P,29,"The Sales Representative solution is for entry-level sales positions in which employees proactively sell products to customers and have their pay and/or performance based on sales revenue. Sample tasks for these jobs include, but are not limited to: promoting products to customers, persuading customers to buy products, and completing a transaction with a customer. Potential job titles that use this solution are: Sales Representative, Sales Associate, and Sales Clerk. Multiple configurations of this solution are available.","Entry-Level,","English (USA),"
Sales Supervisor Solution,https://www.shl.com/solutions/products/product-catalog/view/sales-supervisor-solution/,Yes,Yes,A B P,38,"The Sales Supervisor solution is an assessment used for job candidates applying to entry-level sales leadership positions that generally supervise employees and have a significant portion of their job performance based on sales. Sample tasks for these jobs include, but are not limited to: planning and preparing work schedules, promoting products to customers; training subordinates; building ongoing customer relationships; and making day-to-day decisions with minimal guidance from others. Potential job titles that use this solution are: Assistant Sales Manager and Sales Supervisor. Multiple configurations of this solution are available.","Front Line Manager, Manager, Supervisor,","English (USA),"
Sales Support Specialist Solution,https://www.shl.com/solutions/products/product-catalog/view/sales-support-specialist-solution/,Yes,Yes,A B P,43,"The Sales Support Specialist solution is for entry to mid-level sales support positions in which employees work primarily under the guidance of an account manager or operations manager in support of client accounts. Sample tasks for these jobs include, but are not limited to: implementing customer orders, assisting with and coordinating activities, and utilizing processes to meet customer requirements. Potential job titles that use this solution are: Implementation Specialist, Project Assistant, and Sales Support Assistant. Multiple configurations of this solution are available.","Entry-Level,","English (USA),"
Senior Insurance Agent Solution,https://www.shl.com/solutions/products/product-catalog/view/senior-insurance-agent-solution/,Yes,No,A B P,44,"The Senior Insurance Agent solution is for senior-level professional positions in the insurance industry that sell a portfolio of insurance products, including property, casualty, automotive, health, and life. Sample tasks for this position include, but are not limited to: calling on policyholders to deliver and explain policies or suggest additions or changes; calculating premiums; customizing insurance programs to suit individual customers; ensuring policy requirements are fulfilled; and conferring with clients to obtain and provide information when claims are made on a policy. Potential job titles that use this solution are: Insurance Senior Sales Professional, Senior Producer, Insurance Sales Agent, and Insurance Agent. Multiple configurations of this solution are available.","Professional Individual Contributor,","English (USA),"
Senior Sales Professional Solution,https://www.shl.com/solutions/products/product-catalog/view/senior-sales-professional-solution/,Yes,Yes,A B P,42,"The Senior Sales Professional solution is for high-level sales positions in which employees proactively sell products to customers, develop relationships with new or existing customers, and have their pay and/or performance heavily based on sales revenue. Sample tasks for these jobs include, but are not limited to: promoting products to customers, consulting with and persuading customers to buy products, and building ongoing customer relationships. Potential job titles that use this solution are: Senior Sales Representative, Business Development Manager, and Senior Sales Consultant. Multiple configurations of this solution are available.","Professional Individual Contributor,","English (USA),"
Server Solution,https://www.shl.com/solutions/products/product-catalog/view/server-solution/,Yes,Yes,B A P,40,"The Server solution is designed for entry-level positions in the hospitality industry. Sample tasks include greeting customers, taking customer food and drink orders and delivering food items to guests. The solution is focused on work ethic, customer focus and sales. Potential job titles that use this solution are: Server and Waiter/Waitress. Multiple configurations of this solution are available.","Entry-Level,","English (USA),"
Service Associate Solution,https://www.shl.com/solutions/products/product-catalog/view/service-associate-solution/,Yes,Yes,A B P,38,"The Service Associate is designed for entry-level positions that are primarily task focused but may include a customer service component. The solution covers a wide variety of support positions in the hospitality industry and sample tasks may include: cleaning hotel rooms, serving food at buffet lines, parking cars, and/or delivering food to hotel rooms. Potential job titles that use this solution are: Housekeeper, Buffet Server, Room Service Attendant, and Valet. Multiple configurations of this solution are available.","Entry-Level,","English (USA),"
Service Supervisor Solution,https://www.shl.com/solutions/products/product-catalog/view/service-supervisor-solution/,Yes,Yes,A B P,48,"The Service Supervisor solution is designed for entry-level leadership positions in the hospitality industry that oversee hourly and salaried employees in customer facing positions (e.g. Front Desk Associate, Concierge, Guest Service Associate). Individuals in these roles perform many of hte duties of the employees they supervise. Sample tasks may include: assisting challenging guests, coaching employees on their customer service skills, taking corrective action when an employee is performing poorly, and monitoring employees to assess the satisfactory completion of tasks. Potential job titles that use this solution are: Front Desk Manager, Guest Services Supervisor, and Front Desk Supervisor. Multiple configurations of this solution are available.","Front Line Manager, Manager, Supervisor,","English (USA),"
Stock Clerk Solution,https://www.shl.com/solutions/products/product-catalog/view/stock-clerk-solution/,Yes,No,A B P,25,"The Stock Clerk solution is for entry-level retail positions in which employees work primarily in the stockroom handling incoming and outgoing shipment and keeping the sales floor fully stocked. Sample tasks for these jobs include, but are not limited to: unload product shipment, maintain stockroom organization, replenish supplies and products on the sales floor, and process outgoing shipments. Potential job titles that use this solution are: Stock Clerk, Inventory Associate, and Warehouse Associate. Multiple configurations of this solution are available.","Entry-Level,","English (USA),"
Store Manager 7.0 Solution,https://www.shl.com/solutions/products/product-catalog/view/store-manager-7-0-solution/,Yes,No,B C,34,"Our Store Manager 7.0 solution is designed for candidates applying to entry-level leadership positions who tend to supervise hourly employees in a retail or restaurant setting. Sample tasks for these jobs include, but are not limited to: planning and preparing work schedules, assigning employees to specific duties; coaching employees on attendance, conduct, schedule adherence, and work tasks, developing employees' skills; training subordinates; prioritizing multiple tasks and priorities; and making day-to-day decisions with minimal guidance from others.
Report Language Availability: English (USA), Latin American Spanish.","Front Line Manager, Manager,","English (USA), English International, French (Canada), Latin American Spanish,"
Store Manager 7.1 (Americas),https://www.shl.com/solutions/products/product-catalog/view/store-manager-7-1-%28americas%29/,Yes,No,B C,34,"Our Store Manager 7.1 solution is designed for candidates applying to entry-level leadership positions who tend to supervise hourly employees in a retail or restaurant setting. Sample tasks for these jobs include, but are not limited to: planning and preparing work schedules, assigning employees to specific duties; coaching employees on attendance, conduct, schedule adherence, and work tasks, developing employees' skills; training subordinates; prioritizing multiple tasks and priorities; and making day-to-day decisions with minimal guidance from others.","Front Line Manager, Manager,","English (USA), Latin American Spanish, Portuguese (Brazil), French (Canada),"
Store Manager 7.1 (International),https://www.shl.com/solutions/products/product-catalog/view/store-manager-7-1-%28international%29/,Yes,No,C B,34,"Our Store Manager 7.1 solution is designed for candidates applying to entry-level leadership positions who tend to supervise hourly employees in a retail or restaurant setting. Sample tasks for these jobs include, but are not limited to: planning and preparing work schedules, assigning employees to specific duties; coaching employees on attendance, conduct, schedule adherence, and work tasks, developing employees' skills; training subordinates; prioritizing multiple tasks and priorities; and making day-to-day decisions with minimal guidance from others.","Front Line Manager, Manager,","Latin American Spanish, English International,"
Store Manager Solution,https://www.shl.com/solutions/products/product-catalog/view/store-manager-solution/,Yes,Yes,A B P,49,"The Store Manager solution is an assessment used for job candidates applying to entry-level leadership positions who tend to supervise hourly employees. Sample tasks for these jobs include, but are not limited to: planning and preparing work schedules, assigning employees to specific duties; coaching employees on attendance, conduct, schedule adherence, and work tasks, developing employees' skills ; training subordinates; prioritizing multiple tasks and priorities; and making day-to-day decisions with minimal guidance from others. Potential job titles that use this solution are: Store Manager, First Line Supervisor, Retail Manager, Restaurant Manager, and Customer Service Supervisor. Multiple configuration options of this solution are available.","Manager, Supervisor,","English (USA),"
Supervisor - Short Form,https://www.shl.com/solutions/products/product-catalog/view/supervisor-short-form/,Yes,Yes,S,57,"The Supervisor solution is an assessment used for job candidates applying to entry-level leadership positions who tend to supervise hourly employees. Sample tasks for these jobs include, but are not limited to:  planning and preparing work schedules, assigning employees to specific duties; coaching  employees on attendance, conduct, schedule adherence, and work tasks, developing employees' skills ; training subordinates; prioritizing multiple tasks  and priorities; and making  day-to-day decisions with minimal guidance from others. Potential job titles that use this solution are: Team Leader, First Line Supervisor, Call Center Supervisor, and Customer Service Supervisor.","Front Line Manager, Manager, Supervisor,","English (USA),"
Supervisor 7.0 Solution,https://www.shl.com/solutions/products/product-catalog/view/supervisor-7-0-solution/,Yes,No,B C,32,"Our Supervisor 7.0 solution is designed for candidates applying to entry-level leadership positions who tend to supervise hourly employees. Sample tasks for these jobs include, but are not limited to: planning and preparing work schedules, assigning employees to specific duties; coaching employees on attendance, conduct, schedule adherence, and work tasks, developing employees' skills; training subordinates; prioritizing multiple tasks and priorities; and making day-to-day decisions with minimal guidance from others.
Report Language Availability: English (USA), Latin American Spanish.","Supervisor,","English International, English (USA), French (Canada), Latin American Spanish,"
Supervisor 7.1 (Americas),https://www.shl.com/solutions/products/product-catalog/view/supervisor-7-1-%28americas%29/,Yes,No,B C P,29,"Our Supervisor 7.1 solution is designed for candidates applying to entry-level leadership positions who tend to supervise hourly employees. Sample tasks for these jobs include, but are not limited to: planning and preparing work schedules, assigning employees to specific duties; coaching employees on attendance, conduct, schedule adherence, and work tasks, developing employees' skills; training subordinates; prioritizing multiple tasks and priorities; and making day-to-day decisions with minimal guidance from others.
Report Language Availability: English (USA), Canadian French, Brazilian Portuguese.
“IMPORTANT! Please note that you will need to select the correct package depending on which norm you intend to use. The package available for this product is International and Americas"".","Front Line Manager, Supervisor,","Portuguese (Brazil), French (Canada), English (USA),"
Supervisor 7.1 (International),https://www.shl.com/solutions/products/product-catalog/view/supervisor-7-1-%28international%29/,Yes,No,P C B,29,"Our Supervisor 7.1 solution is designed for candidates applying to entry-level leadership positions who tend to supervise hourly employees. Sample tasks for these jobs include, but are not limited to: planning and preparing work schedules, assigning employees to specific duties; coaching employees on attendance, conduct, schedule adherence, and work tasks, developing employees' skills; training subordinates; prioritizing multiple tasks and priorities; and making day-to-day decisions with minimal guidance from others.
Report Language Availability: English International, German, Portuguese, Spanish, Norwegian, Swedish, Dutch, French, English (USA)
“IMPORTANT! Please note that you will need to select the correct package depending on which norm you intend to use. The package available for this product is International and Americas"".","Supervisor, Front Line Manager,","Italian, Norwegian, Spanish, English (USA), French, German, Dutch, Swedish, Portuguese, English International,"
Support Associate Solution,https://www.shl.com/solutions/products/product-catalog/view/support-associate-solution/,Yes,Yes,A B P,38,"The Support Associate solution is designed for entry-level positions that involve little to no interaction with customers. The solution covers a wide variety of support positions in the hospitality industry, and sample tasks may include: food preparation, dishwashing, and/or cleaning. Potential job titles that use this solutin are: Janitor, Food Prep, Laundry Associate and Dishwasher. Multiple configurations of this solution are available.","Entry-Level,","English (USA),"
